int_legacyid,st_description,feature
"133533917,A Casa Bahia e seus parceiros, vendem o produto, mas na~o entrega. Comprei uma maquina de solda, no dia 20/11/2021, e o pagamento foi aprovado no mesmo dia, no meu carta~o de credito. No dia 25/11/2021, sem qualquer justificativa cancelaram o minha compra. Agora a minha fatura ja´ fechou, vou ter que pagar um produto que na~o recebi, produto esse que estou precisando com urge^ncia.

Gostaria que a Casas Bahia, justificasse esse cancelamento, pois esta parecendo que vendem produto que na~o existe, coloca um prec¸o baixo, fazem  propaganda em cima e depois deixa os clientes na ma~o.,Blackfriday"
133475577,Boa tarde, me chamo Paulo Andre´, comprei um xiaomi 4gb de ram 64gb memo´ria, global ,parcelei em 18x , na Black Friday,pelo site do extra, que estava na promoc¸a~o por 1.199 digitei meus dados corretamente, tenho um o´timo limite no carta~o, mas fui informado pela atendente do televendas, que meu banco na~o autorizou, fui ver no meu aplicativo do carta~o e na~o constava nada , simplesmente o extra cancelaram a compra, agora pergunto e o artigo 51 do co´digo do consumidor, se acabou , ou o prec¸o aumentou , pq tava la´ , eu eu finalizei todo o processo de compra, e depois ve^em com lorota, pedido nu´mero 300154870 , que meu celular, pelo valor que eu vi, e comprei,Blackfriday
"133521479,Comprei uma ma´quina de lavar no dia 20/11 de 14kg  marca Consul  no site das Casas Bahia, paguei pelo Pic Pay 

Pore´m ate´ o momento meu pedido na~o foi recebido, sendo que o prazo de entrega e´ no prazo de 7 dias. Quero saber o que aconteceu.Pois ngm consegue me ajudar  e quando ligo na~o atende,Não"
133480579,Dia 6/11 comprei um Ipad 8 32gb (pedido de nu´mero 296485963) pelo site das Casas Bahia, sendo que seria vendido pela KAPEL. O pedido demorou dias para ser postado, sendo que a postagem ocorreu apenas no dia 18/11. No dia 19/11 recebi uma mensagem de que o pedido tinha sido entregue, porem nunca foi  recebido por mim. Fui ate´ a central de distribuic¸a~o de correios de Braganc¸a Paulista (cidade em que moro), e pelo co´digo de rastreio informaram que o pedido foi entregue em outro enderec¸o e que outra pessoa assinou e recebeu. Abri um chamado na mesma hora de que na~o recebi o pedido. Pediram 4 dias u´teis para resoluc¸a~o. Estou no 5o dia u´til e na~o houve nenhuma resposta. Todos os chamados de atendimento online que abri foram extremamente ineficazes e nenhum me deu alguma resposta concreta ou u´til para o caso. Sigo no aguardo, infeliz com o servic¸o.,Não
"133462817,Comprei um ar de janela, no dia 1/11 cujo o prazo de entrega era estourando dia 9/11, apo´s passar 1 dia da data de entrega entrei em contato com a loja via ligac¸a~o e WhatsApp para solicitar o cancelamento, e fiz isso apo´s ver que a minha encomenDa estava parada na transportadora JAdlog desde o dia 5/11.



A transportado e´ horri´vel e mal recomendada por aqui tbm. Enfim hoje ja´ estamos no dia 23/11 o o extra insiste em na~o me devolver o meu dinheiro mesmo com o print de que a transportadora na~o vai me entregar.



Quero meu estorno o quanto antes.



Hoje fiz mais uma solicitac¸a~o de cancelamento o atendente A´lissons as 14:07 me atendeu e as 14:23 disse que havia aberto o meu protocolo de cancelamento, mas ao verificar o protocolo fui informada de que o mesmo na~o existe. 



Quando tento cancelar pelo aplicativo o extra na~o permite.,Blackfriday"
"133540027,Fiz uma compra de uma smart tv pelo site do shopping esfera/ casas bahia, e por esse meio na~o tinha a disponibilidade de retirada do produto, pore´m, ao verificar direto pelo site da casas bahia, vi que ha´ a disponibilidade de retirada do produto. 

O que seria melhor, ja que o prazo de entrega ficou de 16 dias, e o de retirada e´ de ate´ 2h.

Entrei em contato com o chat da casas bahia para solicitar a retirada do produto ja pago, e me foi negado, informando que eu escolhi pela modalidade ""entrega"" e na~o ""retirada"". Pore´m como dito acima, pelo site da parceira ShoppingEsfera/CasasBahia, na~o havia como escolher retirada!

Em resumo, um erro de comunicac¸a~o entre os parceiros, e quem se ferra e´ o cliente!,Não"
"133533249,Boa tarde!



Efetuei a compra de 2 guarda roupas pelo pedido nas casas bahia!



Ocorre que recebi um email dizendo que meu pedido foi cancelado pois a emprrsa na~o conseguiu fazer a entrega por na~o ter alguem pra receber! Isso e´ um grande absurdo, uma enorme mentira!



Nem mesmo a nota fiscal dos produtos foi emitida!



Exijo o cumprimento da oferta e entrega dos produtos comprados e pagos.,Não"
"133483779,Venho atrave´s do reclame aqui como u´ltimo recurso pois ningue´m sabe me informar sobre meu vale presente. No dia 17/11/21 comprei um Xbox se´ries S, na~o me atentei a data de entrega que so´ seria feita dia 4 de janeiro 2022, sendo assim optei por cancelar a compra no dia 18/11/2021 um dia apo´s , optei pelo vale estorno por dizerem ser mais ra´pido com prazo no ma´ximo 3 dias u´teis. Hoje dia 24/11/2021 ate´ o momento nada de vale liguei na central uma atendente despreparada na~o soube me informar o que aconteceu..mas o que ela disse me preocupou ainda mais disse ela "" que vou ter que aguardar ate´ dia 01 de janeiro de 2022 para o vale cair na minha conta"" COMO ASSIM NAO E´ A OPCAO MAIS RAPIDA PELO AMOR UM DESCASO COM CLIENTE ! ESPERO UMA RESPOSTA E Satisfato´ria SENAO VOU ATRAS DOS MEUS DIREITOS COMO CONSUMIDOR . NUMERO DO PEDIDO E´ 298806019.,Não"
133465315,Ja´ liguei va´rias vezes pro SAC e na~o consigo recuperar minha senha. Na~o tenho acesso aos aplicativo porque perdi a senha e na~o tenho acesso ao e-mail e nu´mero de celular antigo, pois meu cadastro e´ antigo. Quando eu ligo as atendentes na~o sabem resolver, na~o conseguem me transferir para o setor que resolva. Enfim, estou perdendo as promoc¸o~es da Black Friday pois queria emitir meu carta~o da empresa. E´ uma falta de respeito muito grande o SAC na~o adiantar pra absolutamente nada.,Não
"133504733,Fiz uma compra no site das casas Bahia no dia 01/11/21. Recebi o e-mail de confirmac¸a~o da venda, pagamento autorizado e prazo de entrega para 16/11/21. Na~o recebi nada ate´ agora e toda tentativa de contato com a central de atendimento e´ para gerar protocolo e a resposta e´ aguardar. Na~o me passam prazo de entrega, na~o me explicam o motivo do atraso, na~o me esclarecem nada. So´ pedem para aguardar.

E´ um descaso com o consumidor. O pagamento foi realizado, mas onde esta´ o produto Casas Bahia? Comprei o produto porque preciso utilizar.

Nu´mero do pedido: 295482067 

Protocolo: 211122-043020



Continuo no aguardo.,Não"
"133505221,Fiz uma compra no site Extra.com.br de uma cadeira gamer que vou dar de presente. Somente depois eu fui descobrir que na~o seria de fato o Extra e sim uma loja parceira que se chama ""Mania Virtual"" que fez a venda e fara´ a entrega. Faz mais de uma semana que quando consulto o co´digo de rastreio aparece apenas como ""entregue a transportadora"", so´ que o pedido ja´ esta´ atrasado e eu na~o consigo contato com a loja ou com os canais de atendimento do Extra que sejam suficientes, somente respostas ba´sicas como ""vamos reforc¸ar a sua reclamac¸a~o"".



Como foi atrave´s do site do Extra que fiz a compra, gostaria que a empresa tomasse providencia e me entregue o meu produto. Na~o quero reembolso, quero que entreguem o produto conforme o combinado.



Ja´ aproveito para acrescentar que esses parceiros da Via Varejo na~o proporcionam a mesma garantia e seguranc¸a na compra de produtos de quando fazemos a compra com a venda e entrega sendo feita diretamente com as empresas da Via Varejo. Ja´ tive va´rios problemas com os parceiros de voce^s! Simplesmente esta~o prestando um servic¸o muito aque´m do esperado.,Não"
133466135,Comprei o iPhone no fim de outubro, apresentou problemas na bateria antes dos 7 dias da compra e estou ate´ agora tentando resolver. Toda hora mudam a data da coleta. Preciso do telefone a trabalho!!! Estou quase entrando com um processo.,Blackfriday
"133516869,No dia 23/11 recebi um anuncio de uma Escova Secadora Britania Soft BES13VD Verde Bivolt 1300W Bivolt no valor de 134,90 com o cupom (""black"") de desconto de 30%. O valor final da mesma deveria ser de 94,93. Entretanto, quando aplicado o cupom o valor da escova ficava por 117,36 (sendo um pouco mais 14% de desconto).

Entrei em contato via telefone 2x e em ambas ligac¸o~es desligaram o telefone na minha cara! Tentei contato, enta~o, via chat do reclame aqui. O funciona´rio quem me atendeu de fato concordou que estava havendo o erro e estava em contato com a equipe responsa´vel por isto, esperei um tempo consideravelmente longo, mas o funcionario disse que estava sendo resolvido, iriam corrigir o cupom e me entregariam o correto, completou dizendo que iriam entrar em contato comigo em ate´ 24h.

Entraram em contato no mesmo dia e me informaram que seria gerado um cupom que eu iria usar em conjunto com o disponi´vel no site e totalizariam 30%. Me pediram tambe´m que gerasse um pedido da Escova Secadora via boleto para que pudessem concluir o cupom que me entregariam. Assim que estivesse disponivel, entrariam em contato comigo em ate´ 24h, mas falaram que no dia 23/11 mesmo estaria disponi´vel!

Aguardei o dia seguinte, ja´ que no dia 23/11 na~o foi liberado e me pediram para esperar ate´ o final do dia (24/11). No final do dia entrei em contato novamente, uma funcionaria me informou que o prazo e´ de 48h e logo desconectou o chat. Hoje (25/11) entrei em contato novamente e me informaram que ainda na~o esta´ disponi´vel e fizeram mais um contato com a equipe e que a reposta deve ser entregue em 24h. MAIS 24H! Sem falar que a funcionaria que me atendeu nem deixou que eu tirasse minhas duvidas, logo desligou o chat. entrei em contato mais uma vez e o funcionario que atendeu disse que tem que esperar mais 24h!

A u´nica questa~o e´ a falta de respeito com o cliente, na~o cumprem com o prazo dado, propoe um cupom de desconto com falha e ainda deixam o cliente sem resposta! 

O que podem fazer para resolver isso?,Não"
"133471385,Estou registrando aqui a minha segunda reclamac¸a~o no Reclame Aqui! Ale´m de inu´meros protocolos de ligac¸o~es, chat do reclame aqui e WhatsApp das Casas Bahia.. Fiz um pedido dia 13/11, totalizando R$ 8.520,70, em dois carto~es. R$ 7.080,00 em um e R$ 1.440,70 em outro. No mesmo dia foram aprovadas pelos 2 carto~es e fui notificada pelos 2. Pore´m, nunca atualizava no site.. Nenhum atendente soube resolver meu problema, so´ registravam reclamac¸a~o e NADA! Liguei para a empresa do carta~o onde passei R$1.440,70 e eles informaram que dia 20/11 as Casas Bahia fizeram o estorno do valor, sem ao menos uma explicac¸a~o. (Antes ja´ constava na fatura e ja´ havia sido descontado do limite do carta~o, segue em anexo). Pore´m, na~o fizeram estorno algum do valor do outro carta~o de R$7080,00. Depois de muita insiste^ncia e reclamac¸a~o, hoje, dia 24/11, tive uma resposta, disseram que o pagamento na~o foi autorizado! SENDO QUE MEU VALOR DE R$7080,00 NA~O FOI ESTORNADO E O DE R$1440,70 A PRO´PRIA CASAS BAHIA ESTORNOU SEM MOTIVO! Na~o foi um problema do carta~o, tanto que ja´ estava constando na fatura dos 2!!!!! Ai quando tento fazer um novo pagamento, so´ tenho a opc¸a~o de fazer o pagamento dos R$8.520,70 inteiro! Sendo que na~o estornaram os R$7080,00, na~o consigo pagar a diferenc¸a somente!!!! Na~o quero que cancelem meu pedido, por erro DE VOCE^S MESMO! Fiz o cashback da Me´luiz nas Casas Bahia de 15%, cancelando meu pedido, irei perder.  Parece que e´ uma total enganac¸a~o, que so´ fizeram com que meu pedido desse problema para na~o me darem meu cashback. Caso na~o resolvam o meu problema ou cancelem o meu pedido contra a` minha vontade, irei correr atra´s dos meus direitos! Estou extremamente irritada e decepcionada com as Casas Bahia! NINGUE´M RESOLVE NADA! NEM MESMO NO CHAT AQUI DO RECLAME AQUI! 





Nu´mero do pedido 298064950





RESOLVAM O MEU PROBLEMA! JA´ ESTOU AGUARDANDO HA´ 11 DIAS PARA A RESOLUC¸A~O, JUNTAMENTE COM TODOS OS PROTOCOLOS SALVOS, INCLUSIVE DO BANCO, ONDE ME INFORMARAM QUE VOCE^S ESTORNARAM SEM MOTIVO!!!!!,Blackfriday"
133526051,Fiz uma compra pelo site de um notebook 2 em 1 onde o pagamento foi aprovado pelo carta~o. Depois de uma longa espera por parte da loja vi que o meu pedido foi cancelado por eles mesmo. Na~o se trata do cancelamento em si, se trata da falta de responsabilidade e relac¸a~o afetiva com o cliente, pois a gente confia que ao realizar a compra tenhamos no mi´nimo a dece^ncia de saber o porque a loja fez o cancelamento. Deixo aqui registrado a minha imensa insatisfac¸a~o e pouco caso para com o cliente.,Não
"133452059,Ola´. Estou tentando ha´ 5 dias mudar o enderec¸o de entrega do meu pedido e ningue´m consegue me ajudar.

Na~o tenho mais acesso ao enderec¸o do pedido e queria mudar para um lugar pro´ximo.

Todas as outras empresas que pedi fizeram isso pra mim. Ja´ as casas bahia na~o.

Va~o resolver meu problema?

Na~o quero meu dinheiro de volta ou vale compras. Eu quero o meu pedido no enderec¸o novo. So´ isso.,Blackfriday"
"133482501,Comprei uma cadeira de escrito´rio ergono^mica tela com brac¸o RCP azul claro, estava anunciado por R$ 68,00 mais R$ 24,00 de frete para meu enderec¸o, mais a compra na~o fecha, comprei com pix ai devolveram o pix, isso foi dia 22/11 e 23/11, ate´ um vendedor entrou em contato comigo pelo whatzap e tambe´m na~o conseguiu fechar a venda. 

E Hoje dia 24/11 a cadeira saiu da promoc¸a~o ela custa hoje R$ 679,00 e se comprar a compra fecha normalmente.

Propaganda enganosa, quero a cadeira, pelo prec¸o da promoc¸a~o como estava no site, e app, tenho todos os prints, e e-mail do ponto frio.

Cadeira co´digo do item:  1521080618,Não"
"133459499,Comprei uma geladeira no dia 8 de novembro de 2021 com entrega prevista para o dia 18 de fevereiro de 2021. No entanto no dia 17 de novembro veio outra com modelo totalmente diferente eu entrei em contato e nada resolvido. Hoje no dia 24 de novembro de 2021;fui atendida pela atendente Leti´cia as 13 30 com o n do protocolo n 211117008067 e novamente sem previsa~o de entrega. Friso que estou passando por constrangimento e perda material visto que meus alimentos esta~o estragando.,Não"
"133484997,Boa noite 

Preciso recuperar minha senha mas perdi meu email cadastrado e na~o estou conseguindo

Gostaria de fazer compra.

Fico no aguardo, att,Não"
133478833,Realizei a compra de 4 pacotes de fraldas no site dia 13/11. A entrega dos mesmos e´ ia 24/11/21, e a transportadora realizou a entrega de apenas 1 pacote na data de hoje. Ja´ abri chamado para resoluc¸a~o, pore´m o atendente informou que voce^s da~o o prazo de ate´ 7 dias u´teis para resolver. O que e´ um absurdo ja´ que estou esperando o produto ha 11 dias!,Blackfriday
133547603,Comprei uma inversora de solda Boxer flama 161bv  no site 20/11, esperei a Black Friday para encontra o melhor prec¸o e ja´ estava na espectativa da chegada do produto que no site dizia que chegaria ate´ o dia 30/11 mais sem nenhuma explicac¸a~o cancelaram meu pedido 299696652. Falei no atendente pelo whatsapp e ele disse que teve um problema no estoque. Acho engrac¸ado que esperam 5 dias  para verificar isso. So´ que agora na~o consigo comprar o mesmo produto com este valor,me disseram que iriam estonar o valor ate´ o dia 06/12, so´ que eu queria o produto . Pois eles colocaram um prec¸o de Black Friday no site e depois dizem que na~o tem no estoque.,Blackfriday
"133532443,Minha esposa e eu estamos ha´ alguns meses acompanhando o prec¸o de um tablet que queri´amos comprar esperando uma boa promoc¸a~o. No dia 23/11 o site do extra apresentou o melhor prec¸o dos u´ltimos meses para esse tablet e minha esposa fez a compra na manha~ do dia 24/11 por 1899. A compra (pedido 300267185) foi feita as 7h da manha~ e aprovada pelo carta~o de cre´dito as 8h. So´ que para nossa surpresa hoje vimos que o pedido foi cancelado. Ao ligar para o Extra para verificar o motivo (protocolo 211125024825) me foi informado que foi cancelado ""pela ana´lise do site"". Sem nenhum detalhe adicional e quando argumentei sobre o impacto emocional a atendente me disse que sou ""uma pessoa mimada"" por querer que uma compra que fiz apo´s meses de espera fosse entregue.,Não"
"133539449,Fiz a compra do celular S21. No site das Casas Bahia, esta´ informado que o pedido foi entregue, no entanto, isso na~o ocorreu. Ou seja, pedido na~o entregue



Na~o consigo resposta de quem assinou que recebeu o pedido nem saber se as casa bahia ira~o me enviar outra celular ou devolver meu dinheor.,Não"
133499477,To^ tentando comprar mas nada que eu escolhi estar indo pra o carrinho sendo assim na~o tenho como finalizar nada porque sempre aparece carrinho vazio eu ja´ desinstalei o APP e instalei ja tentei compra pelo web e o msm problema assim fica difi´cil,Não
133496619,No dia 15/11 adquiri um conjunto de mesa com duas cadeiras de varanda. Paguei por pix o valor de R$518,00 incluindo frete. Informaram que do 17/11 havia sido entregue pore´m na~o foi. Ja´ abri reclamac¸a~o mas ate´ agora NADA. Decepcionada com as Casas Bahia.,Não
133524353,Recebi Hoje o produto e o produto veio com defeitos ele nao carrega desligado colocar para carregar desligado ele Liga sozinho a bateria nao Segura carga exemplo selular ESTA com 30% em 1 Segundo ele ja descarregar ele com 7 porcento em 2 Segundo s chegou a 1 porcento e descarregou gostaria que vcs fezessem a troca do produto mais rapido possivel,Blackfriday
133538469,Eu estava prosseguindo a compra de um fone, quando chegou na parte da garantia estendida, o produto passou de R$ 299.00 para R$ 449,00.,Blackfriday
133540301,Acabei de receber a oferta quando vou comprar mais caro so´ pra atrair clientes um absurdo quero comprar no valor me oferecido a cadeira ergometrica.,Não
133512513,Vi no face o anu´ncio da pa´gina uma cadeira ergono^mica 68,90 para comprar tinha que instalar o app , instalei e quando fui verificar para comprar quase 700 reais , um absurdo a falta de honestidade no anu´ncio . Quero comprar pelo prec¸o que esta´ anunciando .conforme print .,Não
"133529033,Comprei uma tv 75 polegadas saiu o valor do meu carta~o e eles simplesmente cancelaram minha compra !! 

Eu quero a tv que eu comprei,Não"
133481903,Fiz uma compra pelo app, o pedido foi cancelado sem meu consentimento queriam forc¸ar o extorno em vale como na~o aceitei falaram que iriam devolver o valar na minha conta corrente so´ que na~o devolveram e sempre ficam mandando esperar mais e mais sem dar a devida soluc¸a~o ao problema pois se eles cancelaram que devolvam o valor de forma ra´pida.,Não
"133549537,fiz um pedido no site da loja na sexta feira, e logo em seguida pedi o cancelamento do mesmo, pois queria alterar a forma de pagamento!

Na~o consigo nenhum retorno ate´ o momento! 

No ato da solicitac¸a~o do cancelamento,.foi me passado o prazo de 48h u´teis.  passado esse prazo tentei contato pelo chat e me passaram que o prazo correto eram de 4 dias u´teis ! 

Pois bem, esse prazo tbm ja´ se encerrou e ainda aguardo retorno !!

Solicito o cancelamento do pedido, nem como o imediato estorno dos valores pagos!,Não"
"133457473,Boa tarde. 

Efetuei a compra de um produto(pedido 297479947) no dia  11/11/21, atrave´s do marketplace das Casas Bahia, cujo o produto  e´ vendido pela loja Vills Parfum. A data de entrega do produto segundo informac¸o~es do aplicativo das Casas Bahia seria dia 17/11/21, pore´m o produto na~o foi entregue, enta~o realizei contato atrave´s do  whatsapp no dia 18/11/21(protocolo 211118-000277) e fui informado que o retorno ocorreria em ate´ 4 dias u´teis o que na~o aconteceu. 

Tambe´m realizei contato dia 23/11 com a Vills Parfum deixei meu contato e na~o recebi retorno.,Blackfriday"
"133527315,Vi uma propaganda da Ponto no site facebook e me interessei pelo item, cliquei para comprar e fui redirecionado para baixar o app e assim fiz, porem o prec¸o mudo para 10 vezes acima do valor. 

Por lei o prec¸o anunciado deve ser praticado. 

Exijo meus direitos. 

Dei print na tela como segue o anex, portanto exigo meus direitos,Não"
"133518895,Fui entrar no site do TudoAzule vi que estavam dando 15 pontos por real gasto no Ponto Frio!

Esses 15 por 1 seria para clientes Clube pagando com o Itaucard Azul. Sou os dois, clube e tenho o carta~o!

Na finalizac¸a~o da compra, que deu o total de R$ 1.749,00 informou que ganharia 17.490 pontos, sendo que o total seria 26.235 pontos na regra de 15 por 1. 



Fazendo contato com o atendimento do Ponto, ningue´m sabe esclarecer a du´vida; Como faz?,Blackfriday"
"133525095,Realizei uma busca mo Google referente a um fone de ouvido. Apareceu o site das casas Bahia anunciando um valor, ao clicar no site o valor esta´ bem maior.

Entrei em contato com o WhatsApp da loja e informaram que na~o podem fazer nada.

Entendo que isso e´ propaganda enganosa, pois anunciam um valor para atrair o cliente e ao abrir o site o valor e´ maior.

Estou enviando os prints que comprovam as diferenc¸as de valores.,Não"
133462905,Comprei um ar condicionado na loja Salvador Shopping no dia 20/11. Ele veio com defeito (sem ga´s) no momento da instalac¸a~o. Acionei a loja para toca. Mas querem enviar um te´cnico para avaliac¸a~o em ate´ 4 dias? Inaceita´vel. Na~o aceito. Direitos do consumidor. Aguardo contato urgente de algum responsa´vel. Entendo que as Casas Bahia e´ uma organizac¸a~o se´ria, correto? Se fosse para consertar algo, consertaria o antigo que tenho. Comprei um NOVO.,Não
133502623,Comprei o produto Apple Watch em 15/11/2021 e solicitei o cancelamento em 17/11/2021 atrave´s do protocolo de cancelamento 211117-003506. O produto foi entregue, pore´m, gostaria de realizar a devoluc¸a~o. Solicitei o cancelamento antes dos 7 dias, pore´m, ate´ hoje na~o houve um posicionamento da loja sobre como posso enviar de volta o produto e receber o estorno de valores.,Não
133502175,o tal carne esta disponibilizado na barra de tarefas do site para mim, porem na~o consigo dar andamento mesmo seguindo as regras para usa-lo. gostaria de usar este beneficio,Não
"133521379,Dia 21/11 fiz a compra de uma escova secadora pelo app da loja a qual forma de pagamento foi via pix no mesmo momento da compra ate´ a presente data os status na~o mudou apesar das inu´meras tentativas de resolver o problema a empresa na~o altera o status tao pouco me devolve o valor.

Sempre o mesmo abri um pedido de aprovac¸a~o do pagamento com urge^ncia 24hs seu problema sera´ resolvido e nisso ja´ va~o 4 dias.,Blackfriday"
"133457299,Esta´ dando erro na hora de emitir a segunda via da nota fiscal, preciso para cadastrar no site da LG e solicitar a garantia estendida prevista na promoc¸a~o.



Nu´mero do pedido 297546904

Data da compra 11/11/2021



Erro: O Modelo informado na chave de acesso e´ inva´lido (diferente de 55).,Blackfriday"
"133546119,Ola´, Comprei um celular pelo site da Ponto frio, e na~o recebi a nota fiscal. Tentei ligar, e na~o consegui falar com um atendente para resolver. Atrave´s do site tambe´m na~o foi possi´vel resolver, pois nem a segunda via da nota consegui retirar.

Meu e-mail e´ r.roger77@gmail.com 

E meu CPF 75783130000

Espero rever a nota fiscal, pois preciso muito dela.,Blackfriday"
133506659,Comprei um produto de n 298779241, a previsa~o de entrega era do dia 23/11, a compra foi realizada dia 17/11. Ale´m de na~o entregarem na data, deram como entregue no dia 25/11 a`s 00:03h. Na~o recebi nenhum produto e na~o consigo falar com um atendente para solicitar o cancelamento da compra. Um absurdo com o consumidor.,Não
"133489069,Dia 12/11 realizei a compra pelo ponto frio do meu pedido que ate´ hoje por volta de 13 hrs ta tarde estava ""aguardando pagamento"" no aplicativo sendo que o pagamento ja´ estava aprovado desdo dia 12/11 no meu carta~o. Durante esse periodo do dia 12/11 a 24/11 entrei em contato diversas vezes com a ponto frio questionando o porque do meu pedido ainda esta aguardando pagamento mesmo o pedido ja aprovado nos meus carto~es e ate ja´ aparecendo na fatura, nunca obitive uma resposta so´ podia pra aguardar mais 24 horas, falavam que o caso havia sido passado pro supervisor, falavam que iam me ligar e na~o obitve nenhuma informac¸a~o nem resoluc¸a~o, hoje recebi um email dizendo que o pagamento na~o havia sido aprovado e que eu precisava inserir novamente os dados de pagamento em ate´ 48 horas ou o pedido seria cancelado automaticamente, entrei em contato com os carto~es ( usei 2 no pagamento) e ambos disseram que o pedido constava como aprovado e que ainda na~o haviam recebido nenhuma solicitac¸a~o de estorno, como o limite do carta~o na~o voltou na~o consigo inserir novamento os dados de pagamento porque meus carto~es na~o tem limite. Entrei novamente em contato hoje tentando resolver minha situac¸ao mas mais uma vez nada foi resolvido, eu era jogada entre dois setores, o setor X me transferia pro Y, o Y transferia de volta pro X, o X de volta pro Y, isso aconteceu umas 5 vezes ate que perdi minha paciencia pois estava me sentindo uma palhac¸a. Eu realmente gostaria muito que desse certo a compra, desejo muito o produto, consegui uma promoc¸a~o boa, criei expectativa que vem sendo frustada. A minha compra esta´ aprovada em ambos carto~es (entrei em contato hoje 24/11 com as duas operadores e ambas confirmaram) eu realmente na~o estou entendo o porque consta na~o aprovado na ponto frio e gostaria muito que fosse solucionado.,Blackfriday"
