int_legacyid,st_description,feature
133503775,No dia 24/11, fiz uma compra de dois aspiradores de pó robô, número do pedido 27129081, onde estavam em promoção com 50% de desconto, recebi o e-mail do Kabum confirmando a compra e a pre-autorização do pagamento, e um SMS da operado do meu cartão confirmando compra aprovada. <br />Porém coisa de mais ou menos uma hora depois, recebo um e-mail informado que a compra foi cancelada por divergência com o cartão de crédito. <br />Hoje pela manhã, entrei em contato com a operadora do meu cartão, e me informaram que está tudo ok com a compra, que não houve nenhuma recusa por parte da operadora, autorização número 671040. <br />Liguei para o SAC, afim de tentar entender o que aconteceu e corrigir para manter a compra, fui informado que o sistema pode cancelar a compra se tiver alguma informação errada, porém eles não podem me passar qual a informação foi errada, e que eu deveria verificar junto a operadora do cartão, informei que já tinha confirmado e que estava tudo ok com o cartão, então a atendente me passou mais umas 5 vezes que o sistema faz isso para proteger o cliente, e pode cancelar por motivos divergentes, quando questionei se conseguiria manter a compra alterando a forma de pagamento, me informou que o pedido já estava cancelado e não teria nada o que fazer, ao questionar se eu estava em contato mesmo com o SAC, e se teria como fazer uma reclamação pois realmente tenho interesse em manter a compra, fui informado que como o pedido consta cancelado não tem o que fazer, apenas fazendo uma nova compra, onde o dobrou o valor do produto.<br /><br />A sensação que dá é que a Kabum se arrependeu de vender o produto nesse valor, onde cancelou o pedido apenas para conseguir vender as unidades pelo dobro do preço. <br /><br />Gostaria que a Kabum honre com sua palavra e finalize a venda conforme foi feita. Pois a compra seria presente de Natal para minha mãe, e agora ela ficará esperando.<br />,blackfriday
"133555945,Comprei uma televisão o KabuM e realmente foi um Bum!  O produto foi entregue na ultima 2 feira 22.11 com a tela toda quebrada. No próprio dia entrei em contato com eles, abri uma reclamação no SAC e fotografei o produto e a embalagem, conforme orientação.<br />No dia seguinte 23.11 retornaram o email informando que iriam  verificar o ocorrido com o time de transportes e em alguns dias teria um retorno com novas instruções. &quot;Se comprei do KabuM que culpa tenho e porque preciso aguardar eles verificarem com o time de transportes?&quot;<br />24.11 fui informado que encaminharam meu chamado &quot;pedido de troca do produto&quot; para área responsável e solicitada a coleta do produto junto a transportadora, pediram para que eu confirmasse meu endereço e todos os dados para retirada do produto.<br />25.11, entrei em contato pelo telefone pois passadas 24horas do ultimo contato por email não obtive retorno e para minha surpresa, solicitaram todas as informações novamente. Informaram que não possuem data para retirada do produto e somente após retirada do produto e analise, poderão se posicionar quanto ao envio de outra televisão.<br />Infelizmente esta empresa ainda não está preparada para atender o consumidor, pois a mesma esta duvidando da palavra que o produto chegou quebrado, quer analisar para se posicionar. Pior, não sabem quando a transportadora poderá retirar o produto, que esta disponível deste 22.11 e muito menos quando irão entregar o novo produto. Aonde está o respeito com o consumidor?????? O Produto está pago e minha parte está cumprida, so falta o produto que adquiri.<br />Não comprem nesta empresa, pois se tiveram problema, não tem o menor respeito pelo consumidor... ,Não"
133537001,Dia 24/11 ( Ontem ) através da plataforma de buscas do Google procurando um novo monitor, vi a oferta que apareceu na Kabum do Monitor Asus ProArt 34. Como me interessou e pela confiança e anos de mercado da empresa, não tive o temor de gerar o pagamento via pix, e de imediato, efetuar o pagamento. <br /><br />Pois bem, 1 dia depois eu recebo a Nota fiscal do produto e nela consta: Monitor Asus Gamer 27 polegadas, que com exceção da marca do produto, em nada tem a ver com o produto que anteriormente havia comprado.<br /><br /><br />A kabum está me enviando um produto diferente daquele que eu comprei <br /><br />.<br /><br />Conforme print em anexo, eu efetuei a compra do produto: <br /><br /><br />Monitor Profissional Asus ProArt IPS 4k<br /><br />.<br /><br />Porém, a nota gerada foi referente ao Monitor Gamer Asus 27 165hz.<br /><br />.<br /><br />Gostaria de saber como iremos resolver isto, visto que desejo receber o produto que comprei no ato do pagamento. <br /><br /><br />Obrigado<br /><br />,Não
133509813,comprei um notbook chego dia 24/11/2021 e abri protocolo para devolver dia 25/11/2021 e a kabum me iguinoro fechando o protocolo de arrependimento testei e nao gostei  e nem tirei os plastiquinhos que vem grudado no notbook protocolo 2516438211125  gmail cadastrado na kabum lib****08@gmail.com  quero que voces aceite a devoluçao  e devolva o valor pago na mesma conta corrente em que paguei por pix se tiverem que falar com migo eu respondo por gmail  e whatsapp,Não
"133488705,Fiz a compra no dia 21-11-2021  de um jogo ( Ghost of Tsushima ) no valor de 99 reais.<br />Recebi uma mensagem e e-mail , dizendo que a minha compra não foi autorizada , pois precisa de uma liberação do banco.<br />Meu cartão tem limite , e engraçado , que o jogo que estava 99 reais foi para 175.<br />Meu banco não precisa de liberação , e agora , fico recebendo mensagem dizendo que será feita uma nova tentativa em duas horas pra realizar uma nova cobrança. Por sinal , já comprei uma TV , com uma valor muito maior e não precisou nada disso! <br />Acredito que seja pela mudança do preço , e quem tem que arcar com isso sou eu !<br /><br />Só para constar, fiz uma compra no mesmo dia , em outro site, com um valor bem maior e não pediu nada, como não pedem a mais de 4 anos que tenho esse cartão<br /><br />Entrei em contato por e-mail , e só me mandavam frases automáticas, &quot;desculpe pelo transtorno&quot;<br />E falaram que só pode alterar o cartão depois de 48 horas, mas fui informado depois de muito tempo, ai é complicado<br />Solicitei até o desconto, pois o erro não foi meu, meu cartão está ok, tudo certo, e que eu não poderia arcar com essa alteração, pois eu queria com o valor menor.<br /><br />Entrei em contato com meu banco, tenho protocolo e tudo, resumindo : Tenho limite, não preciso de liberação para compra ( se não pede para uma compra de 2 mil, não vai pedir para de 99 )<br />Exijo uma posição o mais breve possível , pois isso se categoriza como prática abusiva .<br /><br /><br /><br />Essa é a minha última tentativa antes de levar para uma outra esfera.<br /><br />Número do pedido 27057409 - ,Não"
133453477,ESTOU HÁ 2 DIAS TENTANDO DEVOLVER UM FONE BLUETOOTH (QUE SÓ FUNCIONA UM LADO, O OUTRO SO ESQUENTA E NÃO LIGA) PRA SER ESTORNADO E NÃO CONSIGO. PEDIDO N#26741782, SIMPLESMENTE FICA EM ANÁLISE E NÃO PROCEDE. É MUITO TRÂMITE PRA UMA SIMPLES DEVOLUÇÃO. FAZEM DE FORMA PROPOSITAL PARA QUE SEJA DIFÍCIL ESSA PROCESSO E AINDA DENTRO DO PRAZO DE 7 DIAS, O QUE É GARANTIDO EM LEI. Art. 49 do CDC.,Não
133521863,Comprei vários gift cards de Ps em diferentes pedidos, seguem os números: #27072722 #27072648 #27072574 #27072537 #27072498 #27072441 #27072389 #27072340 #27070283<br /><br />Fiz a compra no dia 22/11 e no dia seguinte o site informa que foi entregue. Verifiquei meu email, minha caixa de spam e NÃO RECEBI NENHUM DOS ITENS.<br /><br />Entrei em contato com a empresa no dia 25/11 em torno de 12:00 e fui extremamente mal atendido pela Sra. Caroline. Arrogante e mal educada, disse que não poderia resolver meu problema e me mandou mandar email pro atendimento. se fosse pra fazer isso eu não teria entrado em chat.. Inacreditável!<br /><br />QUERO COM URGÊNCIA RECEBER OS CÓDIGOS DOS GIFT CARDS QUE COMPREI!<br />,Não
"133507449,Por diversas vezes já comprei com a Kabum e não tive nenhum tipo de problema, agora recentemente estou tentando comprar uma TV (samsung qled a60) conforme promoção da Black November no valor 2.999,90 + frete, e por duas vezes recusaram minha compra, na primeira recusa entrei em contato via telefone com a Kabum, falei com o atendente Maick, 24/11/2021 as 15:30, o mesmo me informou que foi por divergência de dados que a compra foi cancelada porem não tinha a informação de  qual seria essa divergência, revemos todos os dados juntos e  na conversa informei que o cartão de credito usado na compra era em nome da minha esposa, o atendente informou que poderia ser esse motivo da divergência (nunca tinha ouvido falar disso), então, efetuei novamente a compra pelo login dela após ter feito uma revisão antes no cadastro em todos os dados dela para não corremos risco de perdemos a compra e por fim a promoção..<br />E novamente depois de algumas horas, pedido cancelado novamente, as duas vezes a compra foi confirma pelo cartão normalmente;<br /><br />Na minha opinião trata-se de uma propagando enganosa a qual a Kabum não está vendendo o produto pelo valor indicado na promoção e usando isso em forma de estratégia para chamar atenção do consumidor, pois tenho certeza que se eu efetuar a compra da TV agora com + de 2000,00 reais mais caro a compra vai ser efetivada até o fim.<br /><br />22/11/2021 1 tentativa de compra : N PEDIDO 27086378<br />24/11/2021 - 2 tentativa de compra : N PEDIDO 27119569<br /><br /><br />Obs: O credito da 1 compra ja foi estornado, aguardo o estorno da 2 compra.<br /><br />E exerço meu direito legal de consumidor, solicitando que habilite minha compra no preço promocional que foi anunciado antes do cancelamento da compra.<br /><br />Tenho todos os prints do site e do cartão referente as compras.<br /><br />Aguardo retorno.,blackfriday"
"133465791,Comprei o produto no site dia 16. Após o produto sair para entrega, houve comunicação de extravio no dia 19. <br /><br />Desde então, após muito reclamar, geraram um novo pedido &quot;fantasma&quot; na plataforma. Porém não geram nova NF, não entregam novo produto à transportadora e a  única comunicação que eu recebo é a de que preciso esperar. Sem um SLA, um novo prazo ou qualquer outro tipo de informação além de: Espere..<br /><br />,Não"
133569523,Recebi um e-mail dizendo que minha encomenda saiu pra entrega ontem as 16:20. Fiquei horas e horas aguardando e nada.<br />Hj já é dia 26 e gostaria de saber aonde tá o entregador com a minha encomenda?<br /><br />Ele tá fazendo entregas a pé? Pq não justifica a demora pra entregar ja que ele se encontra em rota de entrega. Preciso de um parecer ou vou cancelar a compra.<br /><br />,Não
133549919,Fiz uma compra de uma tv, sem nenhuma explicação eles cancelaram minha compra porém mesmo assim foi debitado no cartão! Vou ter que pagar uma parcela enorme sem ter nenhum produto ! Nunca vi isso !,Não
133547109,Meu nome é José Maria e comprei pelo aplicativo da Kabum, em 20 de novembro de 2021, uma cadeira CADEIRA GAMER HUSKY GAMING  STORM, por conta do preço competitivo.<br />Depois de completada a compra, recebi um e-mail da  Kabum, informando que deveria entrar em contato com a operadora de meu cartão de crédito, para que a compra fosse aprovada.<br />Uma hora depois, entrei em contato com a Ourocard Visa, a qual ratificou que a compra deveria ser aprovada, sim, uma vez que a Kabum TEM RESTRIÇÕES DE PAGAMENTO COM A OPERADORA. a VISA ne informou que deveria refazer a operação.<br />Fui, novamente, ao aplicativo e tive de fazer uma nova compra, uma vez que não havia a opção refazer o pedido. Em seguida, remeti um e-mail para o faleconosco@kabum.com.br, solicitando que cancelasse o primeiro pedido. <br />Em torno de três horas depois, percebi que um novo débito pela Kabum, havia sido feito em meu cartão de crédito. Tentei fazer um contato pelo chat e não consegui. Tentei o telefone do SAC (19) 2114.4444  e também não consegui, mesmo sendo sábado às 18h, ainda dentro do horário de atendimento, que é previsto até às 20h, conforme está no site. <br />Restou-me, encaminhar um novo e-mail ao faleconosco@kabum.com.br, mais uma vez esclarecendo e solicitando o cancelamento do valor relativo à segunda compra efetuada.<br />Logo no dia útil seguinte, na segunda dia 22 de novembro, recebi por volta das 07h20, um e-mail da Kabum, informando que o pedido indevido acabava de ser separado para se encaminhado.<br />Liguei ao SAC às 08h23 e o atendente Miguel recebeu meus esclarecimentos e solicitação de estorno da compra indevida. Ele me informou que não poderia cancelar o pedido, uma vez que, automaticamente e no sábado, já havia sido despachado, mesmo tendo encaminhado o meu e-mail ao faleconosco@kabum.com.br.<br />Informou que o procedimento seria não receber o produto na entrega e que, aí sim, eu teria meu estorno. Não me deu nenhum número de protocolo, uma vez que a Kabum não registra atendimentos por meio de protocolos, conforme o Miguel me informou.<br />Mais uma vez, remeti um novo e-mail faleconosco@kabum.com.br, novamente sem qualquer resposta (ainda não me responderam nada e o e-mail não retornou como inválido). <br />Por fim, acabei recebendo as duas cadeiras e não responderam minhas solicitações por e-mail. Tomei a decisão de receber as duas cadeiras POR NÃO ACREDITAR que a Kabum me estornaria, ou seja, medo de devolver o produto e a loja não fazer o estorno. <br />Cabe ressaltar que nunca vi esse tipo de procedimento. Normalmente, há a possibilidade de estono na maioria dos estabelecimentos, quando solicitado imediatamente, o que não ocorreu de forma alguma com a Kabum.<br />No aplicativo, há até a opção de arrependimento da compra, que não funciona. Não consigo, nem mesmo, fazer uma avaliação do produto, nem no aplicativo e nem no site.<br />Ou seja, COMPREI UM PRODUTO QUE NÃO QUIS. Fiz reclamações diversas em tempo mínimo e não recebi qualquer resposta ou atenção por parte da Kabum, o que me leva a NUNCA MAIS COMPRAR OU CONFIAR NA KABUM.,Não
133468697,Adquiri um monitor em 16/11/2021 com entrega prevista para dia 22/11/2021. Não houve entrega dia 22/11/2021 e ontem o sistema da Sequoia, parceira da Kabum acusou que o produto tinha saído para entrega. Como moro em um prédio com portaria estava ansioso pois sabia que o produto teria chegado e estaria na portaria. Pois bem, não chegou e para minha surpresa o sistema da Sequoia atualizou para DESTINATÁRIO AUSENTE.<br /><br />Entrei em contato agora com o chat da Kabum! para tentar uma solução ou cancelar a compra, não consegui. Ou seja, não sei quando o produto vai chegar, se é que vai chegar e paguei 42 reais de frete para ser feito de palhaço!,Não
133453003,no cadastro do meu pai tentei comprar 1 tv e fiz a operação 3 vezes pois a operação anterior sempre era cancelada, desconheço os motivos.. acontece que o limite do meu cartão foi todo comprometido como se tivesse efetuado as operações e não foi completado nada! liguei na operadora do cartão e os mesmos disseram que a kabum deve efetuar o estorno ( de uma compra que nao foi nem feita, so estão segurando meu limite)<br />KABUM, preciso usar meu cartão para compras de casa, necessidades urgentes! Um absurdo voces segurarem o limite do meu cartão sendo que nao existe a compra!!!!!!! ja liguei e pedi cancelamento e estorno, e voces estão dificultanto e muito esse processo!<br />Estou totalmente decepcionada com a forma de trabalho da kabum!,blackfriday
"133502579,Faltavam 4h para terminar uma oferta de aspirador de pó, da marca própria, e no site dizia haver 60 unidades disponíveis. Foi negada a compra dizendo que digitei errado o código verificador. Refiz a compra, com outro cartão, e dessa vez dizia haver ainda 26 unidades do produto. A operadora chegou a confirmar que o cartão tinha limite e estava ativo, mas novamente a compra foi negada no site dizendo que novamente eu errei o código verificador. Como pode a operadora confirmar que o cartão está ativo e tem limite disponível e o site &quot;inventar&quot; que eu digitei algo errado? Se não vão manter a oferta, tirem do site. Fingir erro do cliente pra não cumprir a oferta é sacanagem..,blackfriday"
133467979,Hoje fiz uma compra de um monitor que no anuncio tinha senguinte descriçao.<br />Monitor Profissional Asus ProArt 34 IPS, 4K UHD, HDR 400, 100% sRGB, Calman Certified, HDMI/DisplayPort/USB-C, Ajuste de Altura - PA329CV.Por ser um monitor que atendia a minha necessidade eu comprei no pix.Mas horas apos o anuncio mudou.Monitor Gamer Asus 27 LED, Wide, 165 Hz, Full HD, 0.5ms, Adaptive Sync, HDMI/DisplayPort, Ajuste de Altura, Vesa, Som Integrado - VG278QR.E esse monitor nao atende minhas necessidade,gostaria de saber como podemos resolver isto.,blackfriday
133522087, ,Não
133515859,Comprei um produto na kabum  que está demorando pra atualizar o status. <br />E também  queria saber oque significa esse status atual do produto?<br />Pedido 27113448,Não
"133517151,Comprei um SSD recentemente, selecionei o endereço que queria que fosse enviado, pagamento aprovado. Depois de dois dias recebo um email dizendo que o &quot;O sistema encontrou divergência no endereço cadastrado e endereço de entrega&quot; e pedia para retornar um email confirmando o endereço de entrega. O problema já começa aí, tu seleciona um endereço para entrega e depois de dois dias te mandam um email pedindo pra confirmar o endereço. Não bastando isso, no dia seguinte recebo um email dizendo que o &quot;Pedido estava aguardando retorno do cliente&quot;. Tento entrar em contato pelo chat, sem atendimento até agora. Que decadência. ,Não"
133547979,No dia 19 de Novembro de 2021, abri um protocolo de numero 2509015211119. Após alguns dias me pediram mais fotos do produto para analisar, no dia de hoje 25/11/2021 recebi que meu produto não iria ser trocado pois ele teve um defeito físico no produto, sendo que o produto ja veio desta forma, com marcas de amassado na caixa do produto (relatada por foto), o produto nunca foi utilizado e nem instalado. após a resposta negativa sobre a troca, entrei em contato com o chat da empresa pedindo melhores explicações e se teria alguma forme de eu responder esse protocolo pois ele foi encerrado pela loja, e o que foi me respondido é que eles não poderiam fazer nada.,Não
133501025,Fiz a compra de uma TV Sansung QLED na promoção pela conta do meu marido, usando meu cartão de crédito. O limite do meu cartão foi debitado, porém, a compra foi cancelada por divergência, por que o cartão não era no nome do meu marido (nunca vi isso na minha vida) mas tudo bem. Liguei na Kabum e fui informada que teria até 30 dias para o limite ser liberado na conta, como queriamos muito a TV com a promoção, usei todo o resto do meu limite e dessa vez fiz o pedido pelo meu login, todos meus dados corretos, o cartão em MEU NOME e novamente, limite usado, porém, compra cancelada! Resumindo, perdi a promoção, a TV aumentou 2 mil reais o preço e meu limite todo usado e não consigo comprar em outra loja KKKK Isso pra mim foi a maior falta de respeito que já sofri com alguma loja. Gostaria de uma posição da KABUM de pelomenos me ajudar a comprar a TV com a promoção, pq agora vou ser lesada. <br />NÚMERO DO PEDIDO: #27119569,blackfriday
133484979,Solicitei uma smart tv da LG no site aproveitando a promoção de blackfriday, num do meu pedido 27043285. Chegou até que bem rápido mas quando liguei já percebi que a tv estava com defeito. Ela fica muito lenta para qualquer função mesmo as que não utilizam internet, para o som do nada e de vez em quando fica preta, aí tento fazer qualquer função nela e não vai, até para desligar demora uns 10 segundos depois que eu apertei. Não consigo fazer a solicitação de arrependimento e devolução no site, tanto o site quanto o aplicativo simplesmente travam na hora de eu solicitar. Engraçado que para comprar ambos são super rápidos e práticos mas para solicitar uma troca resolvem trancar. Tive que solicitar essa troca manualmente pelo telefone da Kabum mas achei estranho que não tem nenhum número de protocolo. O atendente Luca me pediu para aguardar o prazo de até 3 dias para que me enviem e-mail pedindo as fotos da televisão e me orientando de como fazer a devolução para receber meu estorno. Estou muito triste pois vou acabar não conseguindo comprar outra televisão a tempo de promoções de blackfriday já que vai demorar todas essas transações para que eu finalmente consiga um estorno. Não tenho mais limite para comprar outra tv e ainda vou ter que acabar pagando a primeira parcela dessa tv que me foi entregue com defeito e me encontro aqui sem nenhum protocolo ou orientação de uma televisão que chegou hoje e não pude utilizar nenhum minuto.,blackfriday
133536769,Boa tarde!<br /><br />No dia 23/11/21 comprei uma cadeira gamer na Kabum, porém desde a data não estão me dando o suporte com a atualização do pedido no site que não esta sendo feita até a data de hoje. <br /><br />venho através deste pedir auxilio com os mesmo e mostrar a indignação com o atendimento precário do estabelecimento no qual ao iniciar um chat para saber o que esta acontecendo e logo em seguida pediram uns dados não terminei nem de digitar meu nome e fecharam como se eu estivesse offline.,Não
133534221,Realizei um pedido no site do Kabum dia 23/11/2021 pedido (27089320), onde ficou em análise de aprovação. No dia seguindo o status do pedido estava como cancelado, porém, até o momentos o valor está descontado na minha fatura, ou seja , comprometeu um crédito de 2.100 reais. Um absurdo, nunca vi isso , cancela a compra e desconta o crédito da pessoa ??? Falta de respeito com os clientes, minha primeira e última compra no site, pois me prejudicou muito. Em contato com a central de atendimento me informaram que tem que esperar o fechamento da fatura. A questão é , como vou pode comprar o que eu queria sendo que a Kabum comprometeu meu crédito ??? Aguardo estorno URGENTE. ,Não
133550929,Comprei um aspirador de pó robô em preço promocional no site da Kabum no dia 23/11/21 no cartão de crédito. O mesmo já foi lançado no extrato de pagamentos do cartão. porém sem um motivo plausível cancelaram minha compra alegando divergência de informações. Recebi um e-mail tempos depois da realização da compra informando que os dados do cartão e os dados cadastrais estão divergentes.o que não é verdade pois o cadastro no site é em meu nome com meu CPF assim como o cartão de crédito. Tentei entrar no chat mas fiquei horas esperando. e nenhum atendente me atendeu. Mandei um email para faleconosco@kabum.com.br e ainda não tive retorno. Espero resolver a situação por aqui visto que eu realizei a compra no período em que o produto estava disponível em um determinado valor e agora não consigo comprar novamente pois o preço aumentou. E não cabe simplesmente cancelar sem nenhum motivo cabível já que está tudo certo com meu cartão de crédito e dados cadastrais. Espero uma resposta por parte da empresa. ,Não
"133543747,Efetuei o cancelamento do pedido #27117757 e, por conta disso, tinha disponível um valor considerável na minha conta da KABUM para usar como crédito no site.<br />Hoje (25/11) apareceu uma oportunidade de compra de uma &quot;Placa de Vídeo Asus TUF NVIDIA GeForce GTX 1660 TI T6G Evo Gaming, 6GB GDDR6, NVIDIA Turing Architecture - 90YV0CT9-M0NA00&quot; no valor de R$ 3268 para quem é cliente prime.<br />Assim sendo, incluí no carrinho 2 placas e a assinatura prime.<br />O crédito disponível era mais que suficiente para efetuar a compra dos referidos produtos. Porém, na hora que eu colocava em &quot;finalizar a compra&quot;, eu era redirecionado para a tela anterior de selecionar o tipo de pagamento (só aparecia boleto no valor de R$ 0,00). Mesmo selecionando o boleto (única opção), eu ia para a tela seguinte de finalizar o pedido e, novamente, voltava para a tela anterior de selecionar o tipo de pagamento.<br />Entrei em contato via chat com a atendente Monique Isabel, dia 25 de Nov de 2021, às 14:19 relatando o problema e, após muita demora, às 14:40 ela mandou a seguinte mensagem: &quot;Entendi, tenta deslogar e logar no site novamente e refaça a compra.&quot;. No minuto seguinte, SAIU DA CONVERSA e me deixou sem nenhuma solução (prints em anexo).<br />Por conta desse problema técnico, o tempo foi passando, passando, passando, eu não tive a opção de efetuar o pagamento por outro meio que não fosse o crédito disponível e, no fim das contas, a oferta encerrou e não comprei.<br />Considerando, portanto, que possuo crédito em conta e que ainda possuo interesse no produto, peço que a KABUM entre em contato comigo para finalizar o pedido e cumprir com a oferta apresentada, nos termos do art. 35, I do CDC.<br />Obrigado,blackfriday"
133531285,Fiz uma compra no dia 24/11/2021, de um Ipad no valor aproximado de 8400 reais e aproveitei uma promoção do Santander onde dava 21% de cashback. A compra foi autorizada pelo banco (inclusive usou limite do meu cartão) mas foi cancelada pela Kabum sem nenhuma explicação.<br />Fiz a compra novamente no mesmo dia pra aproveitar a promoção do cashback (que só valia naquele dia) e desde então a compra está em análise.<br />O valor do Ipad agora é 12.000 reais e não tenho mais acesso a promoção de cashback.<br />Porque a Kabum cancelou a compra? Apenas pra eu não participar da promoção? Quando entrei em contato o atendende disse que não podia me falar o motivo do cancelamento,blackfriday
