int_legacyid,st_description,feature
"133576811,Comprei um impressora a vista pela loja online das Casas Bahia. Como opc¸a~o de entrega escolhi o retire ra´pido, que segundo eles eu poderia retirar o meu produto a partir de 2h apo´s a aprovac¸a~o do pagamento. Mas depois que finalizei a compra veio a surpresa. A informac¸a~o que eu recebi foi a seguinte: ""Estara´ disponi´vel para retirada em ate´ 6 dias u´teis"". Decidi comprar no site deles pela urge^ncia em receber essa impressora e por essa ""vantagem"" de poder ir buscar o meu produto no mesmo dia. Trabalho em casa e necessito dessa impressora. Fiquei atrai´do por essa opc¸a~o de retirar no mesmo dia. 

Fui ate´ a loja, onde era pra eu ter retirado minha impressora, e descobri que eles na~o tinham essa impressora em estoque. Enta~o porque eles deixaram essa opc¸a~o de retire ra´pido ativa na loja online? 

Agora, vou ter que esperar ate´ 6 dia U´TEIS para ainda ter o incomodo de ir la´ buscar o meu produto. Na~o e´ a primeira vez que tenho problemas com compras pelo site das Casas Bahia. Certa vez minha esposa comprou pelo site com essa opc¸a~o retire a partir de 2h, chegou a receber um e-mail dizendo que o produto dela estava disponi´vel para retirada, chegando la´ disseram para ela que na~o tinham o seu produto em estoque. Na~o sei se meu problema sera´ resolvido. Mas uma coisa e´ certa, eu nunca mais compro mais nada pela loja online das Casas Bahia, na~o importando o qua~o barato esteja.,Blackfriday"
"133630997,Fiz a compra de uma geladeira produto essencial para meu lar, ja´ aprovaram a compra no carta~o de credito(me informei com a central) e a casas bahia fica fica no site aguardando aprovac¸a~o, e detalhe no site tem que entrega com 1 dia u´til ou seja segunda ou terc¸a da semana que vem, minha geladeira antiga parou de funcionar e estou precisando bastante que a nova geladeira chegue o mais ra´pido possi´vel pois ainda nem fiz minhas compras pelo fato de esperar a nova para armazenar e o que tem pereci´vel de refrigerac¸a~o ta´ na casa de vizinho.. um saco! Espero que aprovem logo para que realmente venha no prazo informado pois dei prefenrecia a casas bahia ate´ mais caro que em outros sites por conta da entrega em 1 dia u´til!

Se for cancelar, cancele logo que comprarei em outra loja pois preciso do produto e na~o posso ficar esperando a boa vontade de nenhuma loja pra isso, estou pagando e na~o e´ de grac¸a!

Segue em anexo

Pedido: N300968904,Não"
"133490501,Efetuei a compra de um Celular no site do Extra (pedido 299450336) e no momento do fechamento do pedido a informac¸a~o que seria entregue ate´ o dia 23/11/2021.

O pedido na~o foi entregue, e a tal Transporta VVLOG na~o entrega o produto, na~o atualiza o rastreamento, ou seja uma empresa que tem respeito zero pelo cliente do cliente deles.

O iro^nico que na Danfe que o EXTRA, CLIENTE da VVLOG esta´ escrito que e´ uma entrega priorita´ria e a VVLOG trata o prazo dessa maneira, imagino coitado do cliente do EXTRA ou melhor da VIAVAREJO que a nota fiscal na~o tenha informac¸a~o de priorita´rio.,Não"
"133616283,Adiquiri um produto no dia 22/11/2021 e no ato da compra foi informado que o produto seria entregue no dia 25/11/2021 contudo na~o foi cumprido. Foi aberto um chamado com prazo de 10 dias para resoluc¸a~o do problema. Se eu comprei um produto para ser entregue no dia 25 e na~o foi entregue na data, me sinto lesada. Comprei porque precisava do produto para aquele dia. Agora na~o posso comprar em outro lugar pois o limite do meu carta~o esta sendo usado por esta compra.

Aguardo uma resoluc¸a~o imediata do Extra.,Não"
133570345,Prezado(a), o Smartphone Samsung Galaxy M62, que comprei (Pedido: 299832153 loja online do EXTRA - PROTOCOLO ABERTO N 211126-004362) esta´ atrasado na entrega. Preciso do celular para trabalhar e estou sem para utilizar. Estou tendo prejui´zo econo^mico. Como podemos resolver isso sem ser via Juizado Especial Civil?,Não
"133587357,Comprei um produto na madrugada do dia 26 de novembro e, minutos depois, solicitei o cancelamento, pois observei que na~o era o que eu buscava. O pedido de cancelamento foi feito logo em seguida, eu reforc¸o. Hoje pela manha~, por volta das 8h, entrei em contato com o Extra pelo Whatsapp e reiterei o pedido de cancelamento, pois estava com medo de o produto ser levado pela transportadora e na~o ser cancelado. Acentuei que eu havia feito a solicitac¸a~o ANTES do pedido ser enviado. A atendente, como o print da conversa mostra, reiterou que o pedido de cancelamento estava em andamento e que eu na~o precisava me preocupar.



Para a minha surpresa, uma hora depois, recebi a noti´cia de que o produto havia sido coletado pela transportadora. Veja: um produto CANCELADO foi COLETADO pela transportadora. Liguei no Extra e fui atendido por uma pessoa muito mal educada e que so´ se dirigiu a mim com condescende^ncia, palavras passivo-agressivas e me tratou como se eu na~o soubesse de nada. Disse que o pedido de cancelamento foi feito DEPOIS da coleta da transportadora e que eu so´ precisava recusar a entrega. 



Eu na~o POSSO esperar recusar a entregar para que o produto depois seja reembolsado. Se eu fiz o cancelamento ANTES do produto ser coletado, o Extra passou por cima do meu pedido. Por que agora eu tenho que arcar com o custo de 4300 reais na minha fatura, de uma vez, para so´ me^s que vem ser estornado? A atendente que me ajudou pelo Whatsapp, inclusive, garantiu que o pedido seria reembolsado em ate´ 7 dias u´teis. Agora que esta´ na transportadora, devo esperar 10 dias u´teis para ele ser entregue, recusar a entrega, esperar ele voltar ao centro de distribuic¸a~o para so´ enta~o esperar 7 dias para ter o dinheiro de volta. E a minha fatura, quem paga? Eu ja´ fiz a compra do produto certo e ja´ paguei, na~o tenho condic¸o~es de tirar 4300 reais de lugar nenhum apenas porque o Extra agiu de ma´ fe´. Quando entro no status do pedido, aparece que a entrega foi cancelada, mas o atendente disse que o produto esta´ com a transportadora e que devo recusar o recebimento. No que acreditar, o que fazer diante disso?



Alia´s, o atendimento deveria passar por mudanc¸as expressivas, porque ha´ tempos que na~o era tratado com tanto sarcasmo e deboche. Espero que esse atendente nunca seja tratado da forma que me tratou. Oferec¸o, em anexo, a gravac¸a~o da conversa com o atendente e com prints de tudo que aleguei aqui.,Não"
133581193,fiz uma compra no site de um celular para entrega dia 24/11/2021 e ate agora nada onde fica o compromisso com o cliente que falta de profissionalismo,Não
"133611967,19/11/2021 Efetuei uma compra de um celular LG k41 era um presente ! Na~o recebi o produto fiquei em casa o dia todo 26/11/2021 empatada de fazer meus compromissos liguei mais de 6x todos os atendimentos na~o resolveram minha solicitac¸a~o na~o sabiam passar informac¸o~es e nem o que houve nem o que a transportadora fez com o pedido nem quando vou receber ! Entrou indignada falta de respeito com o cliente vou colocar na justic¸a ! Ningue´m passa nem qual transportadora e´ e nem quando vou receber

In559237694ac 



 211126018220



21126043052



211126043052

Alguns dos nu´meros de protocolo

To^ ta~o nervosa que minha ansiedade atacou por causa disso 



Quero meu produto ate´ amanha~ !,Não"
133583849,Comprei uma batedeira e um jogo ee talheres um com 2horas pra retirada e outrou com 4 dias, comprei no sa´bado dia 20/11achando que ia ser mais fa´cil, pore´m ja´ estamos do dia 26/11 e nada de libera a retirada dos produtos, qd entro pra ve^ se for liberado so´ diz retirada aparti de 26 de novembro , se qd fui compra estava retirada em 2 horas e o outro retirada em 4 dias, se na~o tem a PORRA DO PRODUTO PRA QUE VENDE ? ningue´m e´ idiota na~o acha que ganhamos na mesa sena que compramos a toa, se compramos e pq precisamos da mercadoria.,Blackfriday
"133479793,Fiz uma compra com a parceria TDA x Pontofrio acumulando 12 pontos para real gasto (compra n 300235928) no qual ocorreu a promoc¸a~o (para esta promoc¸a~o de 12:1 e´ necessa´rio ser Clube Tudo azul, no qual eu fac¸o parte, o produto precisa ser vendido e entregue pela Ponto frio (o produto se encaixa tambe´m nesse requisito) e seguir as regras gerais da promoc¸a~o ""PARA GANHAR SEUS PONTOS E´ NECESSA´RIO REALIZAR O OPT IN APO´S A CONCLUSA~O DO SEU PEDIDO, DO CONTRA´RIO, OS PONTOS NA~O SERA~O CREDITADOS"" no passo em que foi seguida, conforme as imagens em anexo). Entretanto, por conta da administradora do carta~o, a compra foi cancelada. 

Na presente data, 24 de novembro de 2021, fiz outra compra (n 300338589) de outro aparelho, no entanto, ao final da compra (conclusa~o do pedido) na~o apareceu a caixa ""acumule benefi´cios em sua compra"", muito menos a opc¸a~o ""acumular pontos"" conforme as imagens em anexo.

Tambe´m seguiu os requisitos de ""vendido e entregue por Pontofrio conforme a imagem em anexo.

Diante disso, estou requerendo a aplicac¸a~o dos 12 pontos para 1 real gasto sobre a compra n 300338589, uma vez que segui todos os requisitos e regras de tal promoc¸a~o e por culpa do site, na~o foi possi´vel realizar o ""acumule benefi´cios em sua compra e /ou Acumular pontos"" como nos conformes da primeira tentativa.

Caso contra´rio, serei obrigado a tomar as medidas judiciais cabi´veis.,Blackfriday"
"133614411,MINHA MAE EFETUOU UMA COMPRA NO CREDIARIO NA FILIAL 080 PONTO FRIO CALCADAO DE BANGU GERENTE RENATA E COODENADORA DE FILIAL ELISABETE.  MINHA MAE FEZ ESSA COMPRA E POR NAO SABER LER E ESCREVER ELA ASSINA COM A DIGITAL,E ELA ASSINOU JUNTO FOI UMA GARANTIA ESTENDIDA E UM SEGURO JUNTO NUM TOTAL DE 1086,00. A MAIS NA COMPRA DELA. LEVEI A INHA MAE ATE A LOJA E A GERENTE NEM SE QUER APARECEU,JA A COORDENADORA DE FILIAL DISSE QUE NAO TINHA SISTEMA E NAO IRIA CANCELAR. PERGUNTEI A ELA SE TERIA SISTEMA PRA VENDA MAS PRA CANCELAR NAO,ELA RIU COM DEBOCHE E DISSE VOLTA DEPOIS DE 7 DIAS! OU SEJA,VOLTE DEPOIS DE NAO TER MAIS DIREITO DE CANCELAR NADA!

EU DISSE A ELA QUE ISSO ERA CRIME E ELA IGNOROU.RESUMINDO,MINHA MAE VAI PAGAR A MAIS QUERO CANCELAR E NAO SABEMOS O QUE FAZER,Blackfriday"
"133575781,Bom dia Prezados, 

na data de hoje 26/11/2021, fui contato com um funciona´rio das Casas Bahia que havia sido feito uma compra em meu nome.. naturalmente isso na~o ocorreu de minha parte por isso a reclamac¸a~o.

Pec¸o que por favor excluam qualquer cadastro que houver sido feito por um meliante para que na~o fique registro de meus dados em uma empresa que embora respeite na~o efetuei NUNCA cadastro!

Agradec¸o a prestatividade na atenc¸a~o de voce^s (Casas Bahia) em verificar esse tipo de Fraude e entrar em contato, na~o obstante quando verifiquei no site aparece um email que naturalmente na~o e´ meu.

Agradec¸o desde ja´ a atenc¸a~o e fico no aguardo para resolvermos isto quanto antes.

Obrigado,Não"
"133630991,Comprei dia 08/11/21,com a data da entrega dia 29/11

Mas ate´ hoje dia 27/11 o status da minha compra ainda esta em pagamento aprovado

Eles nao mi querem mi da uma satisfac¸a~o antes do dia 30/11,Blackfriday"
"133566741,Notebook da Dell processador I3, 4gb de memo´ria e 256 GB de HD. 



Ontem 25/11/2021 no valor de  2.700,00,  hoje 26/11/2021 esta black Friday 2.849,00 no extra e no ponto frio, com o selo Black Friday.,Blackfriday"
133616099,Na~o consigo alterar o nu´mero do meu celular antigo no cadastro do site do Ponto Frio e, com isto, vou perder o desconto das ofertas da Black Friday.,Blackfriday
133620453,Sempre aparece anu´ncios do ponto frio para mim e toda vez que aperto neles, sou direcionada para o aplicativo e la´ os prec¸os na~o batem, e´ uma diferenc¸a exorbitante,Não
"133633213,Estava buscando uma cafeteira de ca´psulas e o aplicativo ZOOM, que compara prec¸os e da promoc¸o~es me informa que a Ma´quina de Cafe´ Nespresso essenza mini C30 (https://www.extra.com.br/maquina-de-cafe-nespresso-essenza-mini-c30-com-kit-boas-vindas-preta/p/11779520) esta´ por R$249.



O´tima oferta, decidi comprar. Ao adicionar meu enderec¸o, na~o aparecem as formas de entrega. Na~o me diz qualquer aviso como ""na~o pode ser entregue na regia~o"", apenas fica eternamente carregando a opc¸a~o de entrega e na~o carrega. Logo, me faz crer que e´ um bug do site.



Tentei 3 CEPS diferentes, tentei comprar pelo navegador e nada.



Na~o satisfeita, entrei em contato via WhatsApp, que me pediu para entrar em contato por WhatsApp. Me levaram ao televendas - fui atendida ra´pido, ate´ - e a moc¸a me solicitou mais de um CEP e disse que o vendedor na~o entrega na regia~o. E eu perguntei em qual raio de km ele entrega, ela na~o soube me responder, disse que na~o tem acesso a base deles.



E´ RIDI´CULO que em plena Blackfriday no´s tenhamos esse tipo de bug no site, e tenham promoc¸o~es que na~o possam ser enviadas.



A atendente chegou a dizer que mais de um cliente ligou para falar sobre a cafeteira.



Se faz a oferta e na~o pode entregar nem explica por que (se e´ entrega local, ou retirada) , na~o me deixa du´vida a na~o ser de que e´ uma propaganda enganosa.



Esperei o dia inteiro por uma promoc¸a~o e a melhor que tive na~o pude aproveitar.



Sou cliente extra, ja´ fiz outras compras la´, mas com esse amadorismo em PLENA BLACK FRIDAY, nunca mais.,Blackfriday"
133633629,Tenho um cartao ponto frio onde alguns produtos podem ser parcelados em ate 30x sem juros e tentei efetiar uma compra usando parte do limite desse cartao e outro cartao tambem em meu nome e simplesmente nao aceita, pra que colocar a opc¸a~o apara compra em dois cartoes se nao funciona? Nao comprei o produto que estava com o´timo prec¸o na Black Friday e cancelei o carta~o Ponto frio, nunca mais compro nada numa empresa que nao cumprr com seu anunciado e por telefone tambem nao informam o porque^.,Blackfriday
133611017,Eu fiz uma compra de um iPhone 12 no dia 26/11/2021p, por volta das 12:30 pelo valor de 4999.00 reais, mas so´ por volta das 13:30 deu erro na aprovac¸a~o do pagamento via carta~o de cre´dito mas so´ fui notar isso as 17h, mas quando eu fui realizar o pagamento novamente, bem no momento de ir pro carta~o o prec¸o muda para 4999,00 reais.Obs:   Fui buscar atendimento no televenda a atendente na~o demonstrou interesse nenhum em esclarecer o ocorrido comigo .,Não
133583617,Comprei uma caixa de som para dar de presente ao meu filho no dia 12 / 11/ 2021 cuja a entrega seria no dia 16 / 11/2021 e disseram nao encontrar o enderec¸o dai mudaram a data para 25 /112021 e novamente nao entregaram sobre o enderec¸o que eles dizem nao encontrar tratasse de um enderec¸o comercial que funciona de domingo a dominngo de 7 as 22 horas e compro em varios site e nunca tive problema,Não
133605493,Anu´ncio no Google o produto esta´ por R$220,50 e ao clicar o produto abre como R$294. Trata-se de uma torneira gourmet com spray monocomando da marca Prizi.,Blackfriday
133596647,Ao procurar um determinado produto no google, nos anu´ncios aparece o da loja com um determinado valor e  ao entrar no site da mesma, o valor simplesmente muda (obviamente para mais). O anu´ncio te chama atenc¸a~o, te faz querer o produto e quando entra no site e´ bem mais caro do que o anunciado. Palhac¸ada.,Blackfriday
"133573581,Fiz a compra do celular na Black Friday, foi debitado o valor e apo´s alguns minutos foi debitado o valor de 1,00 a mais no carta~o do meu marido. Isso e´ um absurdo, pois acharam que a gente na~o ia ver. 

Quero o estorno do 1,00 agora. 

Imagine quantos reais algue´m pegou. 

Chocada.,Blackfriday"
"133605115,Fui comprar um iphone 12 conforme vi´deo abaixo e o valor dele anunciado esta´ 4137,57 ao abrir o anuncio  ele induz vc a pagar 4699,00 e´ vendido e entregue por casas Bahia propagando enganosa quero comprar o celular com o valor do anuncio 

tenho vi´deo fazendo a compra irei pedir pro meu advogado entrar no procon,Blackfriday"
133617729,Coloquei um foga~o no meu carrinho como na~o tinha  virado ainda o meu carta~o de cre´dito estava esperando, passou nem 3 dias aumentaram o foga~o,  enta~o decei no carrinho pra quando chegace a Black fraider,  pra voltar pro msm valor , e na~o voltou continuou o msm valor auto , ai´ eles colocam como se tivece abaixado o valor , sendo que aumentou,Blackfriday
"133618699,Tomem cuidado e fujam das CASAS BAHIA eles tentam enganar voce^s colocando valores bem menores para chamar atenc¸a~o, com publicac¸o~es enganosas e anu´ncios capciosos, hoje 26/11/2021 nessa Black FRAUDE praticada pela CASAS BAHIA entrei em contato devido a um anuncio de um produto estar com ""prec¸o baixo"" falei com a vendedora Geovana por sinal mal educada que desligou o telefone na minha cara por que viu que jamais iria conseguir fechar negocio e vender o produto nas condic¸o~es estupidas que passou, depois de realizar o cadastro ela simplesmente falou que o produto na~o seria entregue com aquele prec¸o baixo anunciado e que so´ seria entregue pagando o dobro do valor, que as CASAS BAHIA na~o entregam no meu enderec¸o com o desconto que estava, so´ entregaria se PAGASSE O DOBRO, uma grande piada de pe´ssimo mal gosto ou seja eles fazem anu´ncios falsos para chamar atenc¸a~o, destacam o prec¸o com 45% de deconto ou mais pra chamar atenc¸a~o dos potenciais troxas que eles acham que conseguira~o fazer o cadastro e no final vem com esse PAPO FURADO de FUNDO DE QUINTAL acreditando que vai fechar negocio e conseguir ludibriar agente, anuncio falso com desconto alto pra tentar vender mais caro e bem mais caro algo IMPOSSIVEL deles conseguirem, por isso deixo essa denuncia publicamente e na~o adianta eles tirarem o site do ar por que eu tenho todas as telas printadas e essa atitude deles caracteriza basicamente propaganda enganosa e uma bela indenizac¸a~o processual pra pegar na~o so´ um produto e sim mais 70 deles inicialmente o que na~o dizer enta~o de outras graves caracterizac¸o~es que essas maldita postura ira´ gerar contra eles e isso serve para outras lojas tambe´m que por ventura praticarem essa politica visando prejudicar o comprador o qual na~o quer saber de detalhes e sim realmente fechar negocio com empresas licitas que realmente merecem respeito e na~o esse lixo de CASAS BAHIA. O atendimento e´ pe´ssimo, feito com ma´ vontade e ganancia ale´m da falta de educac¸a~o e respeito com a pessoa que tem interesse em algum produto anunciado isso pra fechar o pacote misera´vel das CASAS BAHIA. Pesquisem e fujam dessa joc¸a tenha, certeza que tem muitas outras lojas que realmente valem a pena e sa~o dignas de credibilidade e respeito por parte do consumidor.,Não"
"133577871,Pedi um pedido dia 17/11 e me deram um prazo de entrega ate´ o dia 25/11 . 



Ate´ agora na~o chegou,  e no app se encontra q o meu pedido ja´ foi entregue. Estou sem tv me ajuda ai´,Não"
"133462817,Comprei um ar de janela, no dia 1/11 cujo o prazo de entrega era estourando dia 9/11, apo´s passar 1 dia da data de entrega entrei em contato com a loja via ligac¸a~o e WhatsApp para solicitar o cancelamento, e fiz isso apo´s ver que a minha encomenDa estava parada na transportadora JAdlog desde o dia 5/11.



A transportado e´ horri´vel e mal recomendada por aqui tbm. Enfim hoje ja´ estamos no dia 23/11 o o extra insiste em na~o me devolver o meu dinheiro mesmo com o print de que a transportadora na~o vai me entregar.



Quero meu estorno o quanto antes.



Hoje fiz mais uma solicitac¸a~o de cancelamento o atendente A´lissons as 14:07 me atendeu e as 14:23 disse que havia aberto o meu protocolo de cancelamento, mas ao verificar o protocolo fui informada de que o mesmo na~o existe. 



Quando tento cancelar pelo aplicativo o extra na~o permite.,Não"
"133576187,Comprei um Ar-Condicionado Split Philco PAC12000TFM11 Frio 220V  12.000 BTU/h



R$ 1.589,00 - 1 unidade - Co´digo do item: 1001294141 no dia 17/11/2021 a`s 11:49

. O produto foi instalado hoje, 26/11/2021 mas veio sem ga´s. Gostaria de saber se realmente o ar condicionado vem sem ga´s ou se vem para verificar sem existe algum vazamento.



O produto Ar-Condicionado Split Philco PAC12000TFM11 Frio 220V  12.000 BTU/h vem COM ou SEM ga´s ?,Blackfriday"
133572439,Estou aqui para expressa uma indignac¸a~o em relac¸a~o ao site Extra.com.br . Pois bem, eles esta~o anunciando um produto, tablet samsung s6 lite, mas quando vou verificar o valor do frete atrave´s do CEP informam a seguinte mensagem Desculpe! No momento este produto na~o pode ser entregue na regia~o informada.Ate´ ai´ tudo bem, mas ao colocar CEP de outras regio~es a mesma mensagem reaparece, isto e´,  tambe´m na~o tem entrega disponi´vel,  todos marcam que na~o tem entrega disponi´vel para o Cep informado. Na~o consigo reclamar, pois na~o consigo fazer o pedido. Gostaria da resoluc¸a~o do problema, pore´m eu na~o consigo adicionar o produto aos meus pedidos, na~o aparece nem essa opc¸a~o para mim, simplesmente aparece que o produto na~o tem entrega disponi´vel para nenhum lugar. O mais interessante e´ que venho acompanhando o mesmo produto ha´ meses e nunca aconteceu esse problema, a coincide^ncia e´ ter acontecido no dia da Black Friday, ainda que o produto estivesse indisponi´vel entenderia, mas no site consta como disponi´vel ale´m de ter uma promoc¸a~o em cima do produto. Gostaria de entender isso.,Blackfriday
133610905,Fui realizar a compra de um Smartphone utilizando carta~o de credito e deu como na~o aprovado, ate´ ai tudo bem, apo´s isso o pedido ficou em ana´lise, eu na~o quero mais efetuar a compra desse produto, pode cancelar para mim? Nu´mero do pedido: 301356653,Blackfriday
133597459,Estou realizando a compra do iPhone 12 de 128 gb eu coloquei no carrinho o iPhone e um carregador o valor total da compra deu 5.122,90 , quando vou finalizar a compra aparece a mensagem em vermelho e na~o deixa finalizar ao ver o valor do celular o produto aumentou de valor , eu como cliente na~o tenho culpa , quero pagar o valor que se encontra em minha sacola de 4.979,00, como vai ser feito ? Quero realizar a compra no valor que se encontra em minha sacola !,Blackfriday
133596245,Comprei um hoje um iPhone 12 Apple 128GB Preto Tela de 6,1, Ca^mera Dupla de 12MP, iOS, PEDIDO DE NU´MERO: 301079551 no valor de R$ 4.999,00 na promoc¸a~o da black friday do Ponto Frio junto com o Tudo Azul em que seria possi´vel acumular 12 pontos Tudo Azul a cada R$ 1,00 para clientes do Clube Tudo Azul. Entrei no link corretamente, escolhi o produto onde aparecia a informac¸a~o de que teria 49.990 pontos que seriam acumulados na Tudo Azul. Apo´s dar seguimento na compra nas pro´ximas telas na~o aparece mais nenhuma informac¸a~o de acu´mulo de pontos. Finalizei a compra para ver se apareceria a opc¸a~o de acumular apo´s o pagamento ser efetuado, mas nada aconteceu. Fiquei a semana toda aguardando a promoc¸a~o da black friday justamente para acumular a pontuac¸a~o, poderia ter comprado mais barato em outros locais, mas aguardei e comprei no Ponto Frio justamente para acumular a pontuac¸a~o e na~o foi dada a opc¸a~o de Acumular pontos. Me senti lesada com a promessa de uma promoc¸a~o que na~o aconteceu.,Blackfriday
"133569817,O site do Ponto Frio esta´ acumulando pontos na TudoAzul nessa BlackFriday. Os anu´ncios deveriam exibir um selo ""TudoAzul"" indicando que aquele produto acumula pontos na TudoAzul, e´ ao final, deveria mostrar um bota~o ""acumular pontos"". Escolhi um produto na pa´gina da promoc¸a~o e finalizei a compra. Na~o exibiu nada de acumular pontos. Cancelei a compra e agora aguardo o estorno antes do dia 27 para acumular esses pontos. Minha reclamac¸a~o: na~o ha´ em NENHUM PRODUTO da pa´gina pa´gina Ponto Frio esse selo TudoAzul. Parece ate´ uma enganac¸a~o essa promoc¸a~o do PontoFrio.,Não"
133592227,Pesquisei um tablet em vario sites de comparac¸a~o de prec¸os e achei interessante o prec¸o do pontofrio.com so´ que quando fui fechar a compra a pontofrio.com informou que na~o tinha o produto. Voltei a pesquisar e continuou a aparecer as propagandas da pontofrio.com. foi decepcionante.,Blackfriday
"133565687,Apareceu uma propaganda mas quando clica o produto e´ 9x mais caro. 

Absurdo isso e enganac¸a~o.,Blackfriday"
"133585925,Ahhhhhh a Black Friday... ta~o conhecida no mundo e uma complexidade de abuso ao consumidor no Brasil !



Estou ha´ 2 semanas analisando prec¸o de Ma´quinas de Lavar e cheguei a conclusa~o que compraria uma Lavadora de Roupas Electrolux Turbo 10.5 kg.



O prec¸o do Ponto frio estava em 1599,00 a semana toda.



Hoje, Black Friday, vejo que esta´ por R$ 1299,00, 110v, podendo pagar em 10x, sem juros e com frete gra´tis ! CHEGOU O DIA !



Coloquei no carrinho e fui finalizar minha compra. Por incri´vel que parec¸a - risos - a compra na~o foi efetuada.. Logo fui eu de novo, realizar a mesma compra, e pasmem, o produto estava R$ 1599,00 + FRETE de 70 reais - QUEM DIRIA - risos ao quadrado -.



Entrei em contato com o televendas, que na primeira vez desligou na minha cara. Pore´m na segunda foi possi´vel, na~o me deram nenhuma explicac¸a~o plausi´vel pela mudanc¸a do prec¸o, tampouco quanto a possibilidade de cumprir a oferta apresentada.



Depois, na~o sei por qual raza~o, o desconto voltou, so´ que so´ era para a ma´quina 220v. Ou seja, um show de horror !



Por uma ironia do destino, e ja´ sabendo de como funciona a Black Friday, consegui tirar um print de grande parte de toda essa falcatrua. Estou juntando na presente reclamac¸a~o, e ja´ pronto para apresentar ao procon.



E´ isso pessoal, pesquisem, questionem, fac¸am prevalecer o seu direito.,Não"
